<?xml version="1.0" encoding="UTF-8"?>
<!--
	This xml file should be processed by Maven's resources plugin.  Which replaces
	${â€¦} with property values defined in the pom.
-->


<zylabPatisClientConfig
	xmlns:xsi='http://www.w3.org/2001/XMLSchema-instance'
	xmlns='http://search.aida.eureca.maastro.nl/zylabpatisclient/config'
	xmlns:zpsc='http://search.aida.eureca.maastro.nl/zylabpatisclient/config'
	xmlns:vocab='http://clinisearch.ad.maastro.nl/zylabpatis/'
	xmlns:pcq='http://clinisearch.ad.maastro.nl/zylabpatis/'
	xmlns:local='http://localhost:8080/zylabPatisClient/zpsc/queryPattern/'
	xsi:schemaLocation='http://search.aida.eureca.maastro.nl/zylabpatisclient/config file:/home/kasper/git/aida.git/Search/search/src/main/xsd/zylabPatisClientConfig.xsd'
	>
	
	<index>
		<localIndex file="file://${aida.indexdir}/${aida.index}" />

		<!-- Examples of indexes -->
<?ignore
		<webservice address="http://clinisearch.ad.maastro.nl/axis/services/SearcherWS" index="Zylab_test-20130415-02"></webservice>
		<localIndex file="file:///var/local/aida/indexes/Zylab_test-20130602" />	
		<localIndex file="file:///home/kasper2/mnt/aida/indexes/Zylab_test-20130602" />	
		<localIndex file="file:///home/kasper/tmp/vocab/aida/Zylab_test-20130602" />	
		<localIndex file="file:///home/kasper/tmp/vocab/aida/indexes/Zylab_test-20130602" />	
		<webservice address="http://other.org/ws" />
?>
	</index>

	<defaultField field="content" />
	<resultLimit nHits="1000" />
<!-- Lists of patients and data to validate a concept query-->
	<patients concept-ref="pcq:metastasis" file="file://${aida.validationdata.metastasis}" />
	<patients concept-ref="pcq:chemokuur" file="file://${aida.validationdata.chemo}" />

<!-- Examples of lists of patients and data to validate a concept query -->
<?ignore
	<patients concept-ref="pcq:metastasis" file="file:///home/kasper/git/aida.git/Search/zylabPatisClient/data/patients-metastasis-20121221_AD2.json" />
	<patients concept-ref="pcq:chemokuur" file="file:///home/kasper/git/aida.git/Search/zylabPatisClient/data/patients-chemo-20121221_AD2.json" />
?>

<!-- Examples of queries, currently unused -->
<?ignore
	<query id="zpsc:scopedQuery1">This can be some content parsable by Lucence's query parser</query>
	<query id="unscopedQuery2">Query string for unscoped query</query>
	<query id="vocab:longparenchym">longparenchym</query>
	<query id="local:longparenchym">longparenchym</query>
	<query id="vocab:empty"> </query>
?>
	

</zylabPatisClientConfig>

<!-- vim: set tabstop=2 shiftwidth=2 :-->
